{
  "$schema": "https://json-schema.org/draft/2020-12/schema",
  "$id": "https://llm-field-notes.local/schema/graph@1",
  "title": "LLM Field Notes knowledge graph",
  "description": "Portable internal representation used by the browser graph, backups, and external projections.",
  "type": "object",
  "required": ["schema", "version", "documents", "nodes", "edges", "revisions"],
  "properties": {
    "schema": {
      "const": "llm-field-notes/graph@1"
    },
    "version": {
      "type": "integer",
      "minimum": 0,
      "maximum": 9007199254740991
    },
    "updatedAt": {
      "type": ["string", "null"],
      "format": "date-time",
      "maxLength": 128
    },
    "committedAt": {
      "type": ["string", "null"],
      "format": "date-time",
      "maxLength": 128,
      "description": "Optional local persistence commit timestamp used to order undo and restore rollbacks across browser tabs."
    },
    "redacted": {
      "type": "boolean",
      "description": "True when source text, evidence quotes, and source URIs were intentionally removed."
    },
    "graphFingerprint": {
      "type": "string",
      "pattern": "^fnv64-[0-9a-f]{16}-[0-9]+$",
      "maxLength": 128,
      "description": "Optional deterministic fingerprint of the normalized graph, used to verify portable JSON exports."
    },
    "appVersion": {
      "type": "string",
      "minLength": 1,
      "maxLength": 64,
      "description": "Optional bounded producer version for portable graph exports."
    },
    "documents": {
      "type": "array",
      "maxItems": 1000,
      "items": { "$ref": "#/$defs/document" }
    },
    "nodes": {
      "type": "array",
      "maxItems": 5000,
      "items": { "$ref": "#/$defs/node" }
    },
    "edges": {
      "type": "array",
      "maxItems": 10000,
      "items": { "$ref": "#/$defs/edge" }
    },
    "revisions": {
      "type": "array",
      "maxItems": 20,
      "items": { "$ref": "#/$defs/revision" }
    },
    "learning": {
      "type": "object",
      "required": ["examples"],
      "properties": {
        "examples": {
          "type": "array",
          "maxItems": 500,
          "items": { "$ref": "#/$defs/learningExample" }
        }
      },
      "additionalProperties": true
    },
    "integrity": {
      "type": "object",
      "required": ["ambiguousSourceIds", "ambiguousEdgeIds"],
      "properties": {
        "ambiguousSourceIds": {
          "type": "array",
          "maxItems": 100,
        "items": { "type": "string", "maxLength": 200 },
          "uniqueItems": true
        },
        "ambiguousEdgeIds": {
          "type": "array",
          "maxItems": 100,
          "items": { "type": "string", "maxLength": 200 },
          "uniqueItems": true
        },
        "conflictingNodeIds": {
          "type": "array",
          "maxItems": 100,
          "items": { "type": "string", "maxLength": 200 },
          "uniqueItems": true
        },
        "conflictingEdgeIds": {
          "type": "array",
          "maxItems": 100,
          "items": { "type": "string", "maxLength": 200 },
          "uniqueItems": true
        },
        "truncated": {
          "type": "object",
          "properties": {
            "documents": { "type": "integer", "minimum": 0, "maximum": 4294967295 },
            "nodes": { "type": "integer", "minimum": 0, "maximum": 4294967295 },
            "edges": { "type": "integer", "minimum": 0, "maximum": 4294967295 },
            "revisions": { "type": "integer", "minimum": 0, "maximum": 4294967295 },
            "learningExamples": { "type": "integer", "minimum": 0, "maximum": 4294967295 },
            "documentTitle": { "type": "integer", "minimum": 0, "maximum": 4294967295 },
            "documentText": { "type": "integer", "minimum": 0, "maximum": 4294967295 },
            "evidenceText": { "type": "integer", "minimum": 0, "maximum": 4294967295 },
            "evidenceItems": { "type": "integer", "minimum": 0, "maximum": 4294967295 },
            "sourceReferences": { "type": "integer", "minimum": 0, "maximum": 4294967295 },
            "aliases": { "type": "integer", "minimum": 0, "maximum": 4294967295 }
          },
          "additionalProperties": false
        },
        "dropped": {
          "type": "object",
          "properties": {
            "documents": { "type": "integer", "minimum": 0, "maximum": 4294967295 },
            "nodes": { "type": "integer", "minimum": 0, "maximum": 4294967295 },
            "edges": { "type": "integer", "minimum": 0, "maximum": 4294967295 },
            "revisions": { "type": "integer", "minimum": 0, "maximum": 4294967295 },
            "learningExamples": { "type": "integer", "minimum": 0, "maximum": 4294967295 }
          },
          "additionalProperties": false
        }
      },
      "additionalProperties": true
    }
  },
  "$defs": {
    "evidence": {
      "type": "object",
      "required": ["text", "sources"],
      "properties": {
        "text": { "type": "string", "maxLength": 12000 },
        "sources": {
          "type": "array",
          "maxItems": 200,
          "items": { "type": "string", "maxLength": 200 },
          "uniqueItems": true
        }
      },
      "additionalProperties": true
    },
    "document": {
      "type": "object",
      "required": ["id", "title", "text", "fingerprint", "addedAt"],
      "properties": {
        "id": { "type": "string", "minLength": 1, "maxLength": 200 },
        "title": { "type": "string", "minLength": 1, "maxLength": 200 },
        "text": { "type": "string", "maxLength": 300000 },
        "fingerprint": { "type": "string", "minLength": 1, "maxLength": 200 },
        "uri": { "type": ["string", "null"], "maxLength": 2048, "pattern": "^(?:(?:https?|file):\\/\\/[^\\s@<>]+|(?:urn|doi):[^\\s<>]+|[^:\\s<>]+)$" },
        "addedAt": { "type": "string", "format": "date-time", "maxLength": 128 },
        "quality": { "enum": ["unknown", "primary", "secondary", "tertiary"] },
        "lastReviewedAt": { "type": ["string", "null"], "format": "date-time", "maxLength": 128 }
      },
      "additionalProperties": true
    },
    "node": {
      "type": "object",
      "required": ["id", "label", "aliases", "type", "confidence", "mentions", "feedback", "status", "sources", "evidence", "createdAt", "updatedAt"],
      "properties": {
        "id": { "type": "string", "minLength": 1, "maxLength": 200 },
        "label": { "type": "string", "minLength": 1, "maxLength": 120 },
        "aliases": { "type": "array", "maxItems": 20, "items": { "type": "string", "maxLength": 120 }, "uniqueItems": true },
        "type": { "type": "string", "minLength": 1, "maxLength": 30 },
        "confidence": { "type": "number", "minimum": 0.01, "maximum": 0.99 },
        "mentions": { "type": "integer", "minimum": 1, "maximum": 1000000 },
        "feedback": { "type": "integer", "minimum": -1000000, "maximum": 1000000 },
        "status": { "enum": ["inferred", "accepted", "rejected"] },
        "sources": { "type": "array", "maxItems": 200, "items": { "type": "string", "maxLength": 200 }, "uniqueItems": true },
        "evidence": { "type": "array", "maxItems": 8, "items": { "$ref": "#/$defs/evidence" } },
        "createdAt": { "type": "string", "format": "date-time", "maxLength": 128 },
        "updatedAt": { "type": "string", "format": "date-time", "maxLength": 128 },
        "lastReviewedAt": { "type": ["string", "null"], "format": "date-time", "maxLength": 128 }
      },
      "additionalProperties": true
    },
    "edge": {
      "type": "object",
      "required": ["id", "source", "target", "label", "confidence", "evidence", "sources", "status"],
      "properties": {
        "id": { "type": "string", "minLength": 1, "maxLength": 200 },
        "source": { "type": "string", "minLength": 1, "maxLength": 200 },
        "target": { "type": "string", "minLength": 1, "maxLength": 200 },
        "label": { "type": "string", "minLength": 1, "maxLength": 80 },
        "confidence": { "type": "number", "minimum": 0.01, "maximum": 0.99 },
        "feedback": { "type": "integer", "minimum": -1000000, "maximum": 1000000 },
        "evidence": { "type": "array", "maxItems": 8, "items": { "$ref": "#/$defs/evidence" } },
        "sources": { "type": "array", "maxItems": 200, "items": { "type": "string", "maxLength": 200 }, "uniqueItems": true },
        "status": { "enum": ["inferred", "accepted", "rejected"] },
        "lastReviewedAt": { "type": ["string", "null"], "format": "date-time", "maxLength": 128 }
      },
      "additionalProperties": true
    },
    "revision": {
      "type": "object",
      "required": ["id", "version", "timestamp", "reason", "nodes", "edges"],
      "properties": {
        "id": { "type": "string", "minLength": 1, "maxLength": 200 },
        "version": { "type": "integer", "minimum": 0, "maximum": 9007199254740991 },
        "timestamp": { "type": "string", "format": "date-time", "maxLength": 128 },
        "reason": { "type": "string", "maxLength": 200 },
        "operation": {
          "enum": ["unknown", "migration", "ingest", "rebuild", "feedback", "learning", "manual", "projection", "source-removal"]
        },
        "extractor": {
          "enum": ["unknown", "local", "remote"]
        },
        "nodes": { "type": "integer", "minimum": 0, "maximum": 5000 },
        "edges": { "type": "integer", "minimum": 0, "maximum": 10000 }
      },
      "additionalProperties": true
    },
    "learningExample": {
      "type": "object",
      "required": ["kind", "id", "status"],
      "properties": {
        "kind": { "enum": ["concept", "relation"] },
        "id": { "type": "string", "minLength": 1, "maxLength": 200 },
        "label": { "type": "string", "minLength": 1, "maxLength": 120 },
        "aliases": { "type": "array", "maxItems": 20, "items": { "type": "string", "maxLength": 120 }, "uniqueItems": true },
        "source": { "type": "string", "minLength": 1, "maxLength": 200 },
        "sourceLabel": { "type": "string", "maxLength": 120 },
        "target": { "type": "string", "minLength": 1, "maxLength": 200 },
        "targetLabel": { "type": "string", "maxLength": 120 },
        "status": { "enum": ["accepted", "rejected"] },
        "lastReviewedAt": { "type": ["string", "null"], "format": "date-time", "maxLength": 128 }
      },
      "additionalProperties": true
    }
  }
}
